item_name,current_price,old_price_element,item_discount_element,item_link
Floral Printed Faux Leather Sheets Leopard Pattern Synthetic Leather Fabric Roll for DIY Earrings Hair Bows Pouches Crafts,4588.0,7844.0,42.0,/generic-floral-printed-faux-leather-sheets-leopard-pattern-synthetic-leather-fabric-roll-for-diy-earrings-hair-bows-pouches-crafts-191391447.html
Floral Printed Faux Leather Sheets Leopard Pattern Synthetic Leather Fabric Roll for DIY Earrings Hair Bows Pouches Crafts,4588.0,7844.0,42.0,/generic-floral-printed-faux-leather-sheets-leopard-pattern-synthetic-leather-fabric-roll-for-diy-earrings-hair-bows-pouches-crafts-191388543.html
Professional Manufacturer Southeast Asian Tea House Ceiling Chandelier Rattan Art Wicker Hanging Lamp,6912.0,11840.0,42.0,/generic-professional-manufacturer-southeast-asian-tea-house-ceiling-chandelier-rattan-art-wicker-hanging-lamp-192137940.html
Travel Laptop Backpack With USB Port Durable Large,12130.0,24259.0,50.0,/generic-travel-laptop-backpack-with-usb-port-durable-large-191480072.html
"Computer Case Cover Bottom Back Screws For MacBook Pro 13"" A1278 A1286 A1398 A1502 A1706 A1707 A1708 Air A1369 A1466 A1932",3330.0,5624.0,41.0,/generic-computer-case-cover-bottom-back-screws-for-macbook-pro-13-a1278-a1286-a1398-a1502-a1706-a1707-a1708-air-a1369-a1466-a1932-192246761.html
Tuya Smart Life Wifi/ Water Valve Controller Timer Auto Switch via Smartthings Home istant Yandex Station 2 Alice,6334.0,10804.0,41.0,/generic-tuya-smart-life-wifi-water-valve-controller-timer-auto-switch-via-smartthings-home-istant-yandex-station-2-alice-191420340.html
Battery,3270.0,6540.0,50.0,/generic-battery-192047057.html
Clear Phone Case For Xiaomi Redmi Note 12 Pro+,399.0,570.0,30.0,/generic-clear-phone-case-for-xiaomi-redmi-note-12-pro-192020127.html
Portable Mask Fan Cooler Fan USB Rechargeable Electric Clip-On Black,1990.0,3979.0,50.0,/generic-portable-mask-fan-cooler-fan-usb-rechargeable-electric-clip-on-black-191550339.html
1.0mm Crazy Horse Artificial Leather Fabric Sofa Soft Bag Automobile Furniture Waterproof Synthetic Leather PU Faux Leather,5313.0,9028.0,41.0,/generic-1.0mm-crazy-horse-artificial-leather-fabric-sofa-soft-bag-automobile-furniture-waterproof-synthetic-leather-pu-faux-leather-191396275.html
Glossy Black Letters V8 Biturbo 4matic Emblem for Mercedes Benz AMG C43 C63S Coupe Car Fender Trunk Nameplate Logo Sticker,5358.0,9176.0,42.0,/generic-glossy-black-letters-v8-biturbo-4matic-emblem-for-mercedes-benz-amg-c43-c63s-coupe-car-fender-trunk-nameplate-logo-sticker-192428508.html
SOLO 3 TM-037 Wireless On-Ear Headphone-Pure White BDZ Mall,10380.0,20750.0,50.0,/generic-solo-3-tm-037-wireless-on-ear-headphone-pure-white-bdz-mall-191474627.html
"ZMI Portable USB LED Light With Switch 2.5W Max, 5 Levels Brightness USB Lamp for Power bank / laptop Notebook",5520.0,9472.0,42.0,/generic-zmi-portable-usb-led-light-with-switch-2.5w-max-5-levels-brightness-usb-lamp-for-power-bank-laptop-notebook-191421666.html
Bicycle Rear Light USB Rechargeable High Visibility,2176.0,3046.0,29.0,/generic-bicycle-rear-light-usb-rechargeable-high-visibility-192274984.html
3x Pro Art  Brush For Watercolor Acrylic Oil Painting 1inch 2inch,2031.0,3981.0,49.0,/generic-3x-pro-art-brush-for-watercolor-acrylic-oil-painting-1inch-2inch-192003240.html
Laptop accessories 8Pcs lot For Lenovo for Thinkpad X240 X250 X250I X240I bottom Base case Screw Set 8pcs lot,3789.0,6512.0,42.0,/generic-laptop-accessories-8pcs-lot-for-lenovo-for-thinkpad-x240-x250-x250i-x240i-bottom-base-case-screw-set-8pcs-lot-192257510.html
0.96 Inch Smartwatch Sports Watch Touchscreen Sleep Monitor For Black,1940.0,3879.0,50.0,/generic-0.96-inch-smartwatch-sports-watch-touchscreen-sleep-monitor-for-black-191512174.html
Fashion Invisible Bra Breast Lift Tape Kit with 5 Pairs of Breast Protectors,710.0,1288.0,45.0,/fashion-invisible-bra-breast-lift-tape-kit-with-5-pairs-of-breast-protectors-191764542.html
Fashion Semi-Rimless Vintage Sungles Man Clic Polarized Square Sun Gles Male Retro Mirror Driver Oculos De Sol,2930.0,5032.0,42.0,/fashion-semi-rimless-vintage-sungles-man-clic-polarized-square-sun-gles-male-retro-mirror-driver-oculos-de-sol-192074416.html
2 Pieces Infant Toothbrush With Clean Cup Tongue Cleaner For Oral,870.0,1739.0,50.0,/generic-2-pieces-infant-toothbrush-with-clean-cup-tongue-cleaner-for-oral-191499456.html
915 Generation TAISU Solid State Drive Disk NGFF SSD PCI-E 2280 To 2280,7810.0,14838.0,47.0,/915-generation-taisu-solid-state-drive-disk-ngff-ssd-pci-e-2280-to-2280-129918108.html
TH3P4G3  Metal Housing Box  Dock Case Support OLED Display Cooling Fans,18713.0,32264.0,42.0,/generic-th3p4g3-metal-housing-box-dock-case-support-oled-display-cooling-fans-191567600.html
5mm Wide Turntable Rubber Belt Repment Flat Drive Belt for Vinyl Record Player Phono Belt-Driven Turntables Dropshipping,2930.0,5032.0,42.0,/generic-5mm-wide-turntable-rubber-belt-repment-flat-drive-belt-for-vinyl-record-player-phono-belt-driven-turntables-dropshipping-191213206.html
1-20PCS ESP32 WROOM-32 Development Board 30Pin HW-394 HW-463 WiFi+Bluetooth Low Power Consumption Wireless Module ESP-32 ESP-32S,16680.0,28712.0,42.0,/generic-1-20pcs-esp32-wroom-32-development-board-30pin-hw-394-hw-463-wifibluetooth-low-power-consumption-wireless-module-esp-32-esp-32s-191213023.html
Liasoso Japan Samurai Cat Sushi Knife Sweatpants 3d Print Casual Jogging Harajuku Trousers Women Men's Oversized Pants Clothing,7279.0,12374.0,41.0,/generic-liasoso-japan-samurai-cat-sushi-knife-sweatpants-3d-print-casual-jogging-harajuku-trousers-women-mens-oversized-pants-clothing-187442602.html
Feng Shui Black Obsidian Wealth Bracelet,184.0,377.0,51.0,/generic-feng-shui-black-obsidian-wealth-bracelet-191633199.html
Remover Pore Vacuum Face Cleaning Tool Water  Blue,2516.0,4074.0,38.0,/generic-remover-pore-vacuum-face-cleaning-tool-water-blue-192499450.html
Peanut  Maker,13240.0,26479.0,50.0,/generic-peanut-maker-191569701.html
Table Desktop USB Fan Rotatable 3 Modes Wind Speed Cooling,3552.0,5676.0,37.0,/generic-table-desktop-usb-fan-rotatable-3-modes-wind-speed-cooling-191318443.html
915 Generation Lint Sticking Rollers Sticky Picker Sets Pets Hair Remover,864.0,1643.0,47.0,/915-generation-lint-sticking-rollers-sticky-picker-sets-pets-hair-remover-128730772.html
1 Pair Universal Black/Car Carbon Fiber Screen Car Bumper Spoiler front lip anti-collision For BMW Mercedes-Benz Toyota Audi,5062.0,8584.0,41.0,/generic-1-pair-universal-blackcar-carbon-fiber-screen-car-bumper-spoiler-front-lip-anti-collision-for-bmw-mercedes-benz-toyota-audi-192465844.html
Long Straight Ponytail Hair Extension For Women Natural,1310.0,2490.0,47.0,/generic-long-straight-ponytail-hair-extension-for-women-natural-192607060.html
Waterproof Laptop Bag Tablet 11 12 13.3 14 15.6 16 Inch Case For MacBook Air Pro Xiaomi HP Dell Acer Notebook Computer Case,3730.0,6364.0,41.0,/generic-waterproof-laptop-bag-tablet-11-12-13.3-14-15.6-16-inch-case-for-macbook-air-pro-xiaomi-hp-dell-acer-notebook-computer-case-193312633.html
for Studer ReVox/TEAC/BASF 1/4 10 Inch 3/11 Holes Empty Tape Reel Aluminum Alloy Empty Disc Opening Machine Open Roll Cette,5565.0,9472.0,41.0,/generic-for-studer-revoxteacbasf-14-10-inch-311-holes-empty-tape-reel-aluminum-alloy-empty-disc-opening-machine-open-roll-cette-191206845.html
3 in 1 6A super charging cable micro USB Type-C fast charger micro USB Type-C data cable for iPhone 14 13 Samsung Xiaomi Huawei,5476.0,6216.0,12.0,/generic-3-in-1-6a-super-charging-cable-micro-usb-type-c-fast-charger-micro-usb-type-c-data-cable-for-iphone-14-13-samsung-xiaomi-huawei-191993850.html
12V 1.5A AC Adapter For Viltrox L116T L116B L132T L132B,4830.0,9659.0,50.0,/generic-12v-1.5a-ac-adapter-for-viltrox-l116t-l116b-l132t-l132b-191457283.html
Bike Bottle Cage Multi Bike Cycling Tool Capsule Boxes Store Keys Repair Kit Set Bottle Cage Case(S),2540.0,5070.0,50.0,/generic-bike-bottle-cage-multi-bike-cycling-tool-capsule-boxes-store-keys-repair-kit-set-bottle-cage-cases-191489854.html
Mobile Phone Grip Holder Universal Retractable Round Faux,970.0,1930.0,50.0,/generic-mobile-phone-grip-holder-universal-retractable-round-faux-191439853.html
Samsung Galaxy Z Flip 3 5G Case Magnetic Folding Bracket Phone Case,870.0,1739.0,50.0,/generic-samsung-galaxy-z-flip-3-5g-case-magnetic-folding-bracket-phone-case-191506336.html
Fashion Formal Mens Business Wedding Office Footwear,4940.0,9880.0,50.0,/fashion-formal-mens-business-wedding-office-footwear-192048576.html
Children's SmartWatch SimCard Positioning Tracker Waterproof,3404.0,5525.0,38.0,/generic-childrens-smartwatch-simcard-positioning-tracker-waterproof-193154872.html
New Men's Business Leather Shoes Loafers,2276.0,3799.0,40.0,/generic-new-mens-business-leather-shoes-loafers-191830919.html
Eyeglasses Frame Pliers Professional Stainless For Optician YG1008,2290.0,4579.0,50.0,/generic-eyeglasses-frame-pliers-professional-stainless-for-optician-yg1008-191487756.html
Protective Cover Power Adapter Soft Silicone Case Shockproof Skin 15in 13in Pro 67W Charger Protective Cover,2930.0,5032.0,42.0,/generic-protective-cover-power-adapter-soft-silicone-case-shockproof-skin-15in-13in-pro-67w-charger-protective-cover-193250821.html
915 Generation Yumoshi 13+1Bb Metal Xs Series Spinning Reel Fishing Tackle,4265.0,7465.0,43.0,/915-generation-yumoshi-131bb-metal-xs-series-spinning-reel-fishing-tackle-128827700.html
For Vivo S15 SIM + SIM Card Tray,105.0,154.0,32.0,/generic-for-vivo-s15-sim-sim-card-tray-191686140.html
(Silver)Stainless Steel Necklaces Elegant Red Wine Glass Pendant Chain Collar Fashion Necklace For Women Men Jewelry Party Gifts 1Pcs MAA,1776.0,2831.0,37.0,/generic-silverstainless-steel-necklaces-elegant-red-wine-glass-pendant-chain-collar-fashion-necklace-for-women-men-jewelry-party-gifts-1pcs-maa-192388433.html
Fashion Invisible Bra Breast Lift Tape Kit with 5 Pairs of Breast Protectors,444.0,799.0,44.0,/fashion-invisible-bra-breast-lift-tape-kit-with-5-pairs-of-breast-protectors-191766633.html
2Pcs Invisible Mini Cooling Stand Feet Zinc alloy Foldable Laptop Non-slip Base Bracket Support For Tablet Keyboard,2516.0,4292.0,41.0,/generic-2pcs-invisible-mini-cooling-stand-feet-zinc-alloy-foldable-laptop-non-slip-base-bracket-support-for-tablet-keyboard-191846512.html
Youpin Women Underwear Panties Soft Cotton Comfort Underpants Sexy Low Waist Lace Briefs String Seamless Ice Silk Thin Lingerie,3629.0,6169.0,41.0,/generic-youpin-women-underwear-panties-soft-cotton-comfort-underpants-sexy-low-waist-lace-briefs-string-seamless-ice-silk-thin-lingerie-187836995.html
915 Generation 4Pcs 6 Tooth Kayak Dinghy Inflatable Boat Screw Recessed,3050.0,5796.0,47.0,/915-generation-4pcs-6-tooth-kayak-dinghy-inflatable-boat-screw-recessed-128483932.html
Desktop live broadcast mobile phone tripod handheld stand for GoPro action camera iPhone Samsung smartphone,651.0,1095.0,41.0,/generic-desktop-live-broadcast-mobile-phone-tripod-handheld-stand-for-gopro-action-camera-iphone-samsung-smartphone-190940307.html
Laptop Stand Desktop Raise Bracket Cooling Base Lifting Holder Foldable (Black),2850.0,5690.0,50.0,/generic-laptop-stand-desktop-raise-bracket-cooling-base-lifting-holder-foldable-black-191460641.html
2 Pairs Open-Ear Wireless  Headphones Black+Gray DYY-1,7060.0,14119.0,50.0,/generic-2-pairs-open-ear-wireless-headphones-blackgray-dyy-1-191541247.html
Cycling Bicycle Water Bottle Holder Carbon Fiber Bottle Cage Super Tough Road Cycling MTB Glass Bottle Holder Cup Rack Bike Part,2540.0,5070.0,50.0,/generic-cycling-bicycle-water-bottle-holder-carbon-fiber-bottle-cage-super-tough-road-cycling-mtb-glass-bottle-holder-cup-rack-bike-part-191488947.html
New Men's Jacket Autumn Winter Coat,1918.0,3201.0,40.0,/generic-new-mens-jacket-autumn-winter-coat-191758803.html
2/3/4 Seater Stretch Sofa Seat Cushion Cover Couch Light Grey-4pcs,12390.0,24779.0,50.0,/generic-234-seater-stretch-sofa-seat-cushion-cover-couch-light-grey-4pcs-191605490.html
20x30cm Litchi S Adhesive Leather Fix Repair Patch Stick-on Sofa Repairing Subsidies Leather Multicolor PU Repair Car Sticker,2516.0,4292.0,41.0,/generic-20x30cm-litchi-s-adhesive-leather-fix-repair-patch-stick-on-sofa-repairing-subsidies-leather-multicolor-pu-repair-car-sticker-192285241.html
Matte Black Letters C180 C200 C220d C250d C260 C300d 4Matic ABS Emblem for Mercedes Benz W205 Coupe Car Trunk Logo Sticker,4603.0,7844.0,41.0,/generic-matte-black-letters-c180-c200-c220d-c250d-c260-c300d-4matic-abs-emblem-for-mercedes-benz-w205-coupe-car-trunk-logo-sticker-192441823.html
Spanish Latin Keyboard For HP Pavilion 14-CF 14S-CF 14-DF 14S-DF 14-DK 14S-CR 240 245 G8 With Palmrest Upper Cover Touchpad,14415.0,24716.0,42.0,/generic-spanish-latin-keyboard-for-hp-pavilion-14-cf-14s-cf-14-df-14s-df-14-dk-14s-cr-240-245-g8-with-palmrest-upper-cover-touchpad-191419112.html
for Acer Are 7 A715-71 A715-71G A715-71G-71NC Rear Lid TOP case laptop LCD Back Cover LFront Bezel,11026.0,18944.0,42.0,/generic-for-acer-are-7-a715-71-a715-71g-a715-71g-71nc-rear-lid-top-case-laptop-lcd-back-cover-lfront-bezel-191586589.html
"original SSD, USB 3.0, 4tb, SSD, PC, laptop, storage device",6934.0,8118.0,15.0,/generic-original-ssd-usb-3.0-4tb-ssd-pc-laptop-storage-device-192190681.html
Mobile Phone Holder Hook Design Wall Mounted-White,970.0,1930.0,50.0,/generic-mobile-phone-holder-hook-design-wall-mounted-white-191606460.html
Stainless Steel Cremation Jewellery Urn Pendant Ash,592.0,984.0,40.0,/generic-stainless-steel-cremation-jewellery-urn-pendant-ash-191766302.html
Antique Jesus Scripture Cross  Religious Relics Gold,740.0,1154.0,36.0,/generic-antique-jesus-scripture-cross-religious-relics-gold-192347082.html
Car Brake Pedal Foot Pedal Pads Accessories for,2960.0,4755.0,38.0,/generic-car-brake-pedal-foot-pedal-pads-accessories-for-191355859.html
35cm 48cm Universal Fit Car Spoiler Lateral Bumper Rear Side Skirt Lip Rocker Wings Carbon Fiber Glossy Black Protection Trims,3952.0,6808.0,42.0,/generic-35cm-48cm-universal-fit-car-spoiler-lateral-bumper-rear-side-skirt-lip-rocker-wings-carbon-fiber-glossy-black-protection-trims-192450153.html
for Ford Raptor F150 pickup truck decoration rear label car sticker 6.2L car accessories dispment label letter,3300.0,5624.0,41.0,/generic-for-ford-raptor-f150-pickup-truck-decoration-rear-label-car-sticker-6.2l-car-accessories-dispment-label-letter-192438430.html
Adjustable Elastic Silk Long Sleep Cap Postpartum Household,1390.0,2640.0,47.0,/generic-adjustable-elastic-silk-long-sleep-cap-postpartum-household-192590606.html
For Acer Are 5750 5750S 5750G 5750Z 5750ZG P5WE0 Laptop LCD Back Cover Front Bezel Bottom Case Screen Top Cover Frame Speaker,10079.0,17316.0,42.0,/generic-for-acer-are-5750-5750s-5750g-5750z-5750zg-p5we0-laptop-lcd-back-cover-front-bezel-bottom-case-screen-top-cover-frame-speaker-191421824.html
35355-T7A-J01 35355T7AJ01 for H HRV XRV HR-V XR-V VEZEL Electronic Automatic Hand Brake on Parking Brake Switch,3985.0,6800.0,41.0,/generic-35355-t7a-j01-35355t7aj01-for-h-hrv-xrv-hr-v-xr-v-vezel-electronic-automatic-hand-brake-on-parking-brake-switch-207555113.html
LCD Screen And Digitizer Fullembly For Nokia 1.4(Black),6850.0,13690.0,50.0,/generic-lcd-screen-and-digitizer-fullembly-for-nokia-1.4black-191532868.html
3M Kid's Coloring Paper Roll Mess Free Sticky Paper Roll for Toddler Wall Coloring Activity Stickers Set Toys for Kids,3019.0,5180.0,42.0,/generic-3m-kids-coloring-paper-roll-mess-free-sticky-paper-roll-for-toddler-wall-coloring-activity-stickers-set-toys-for-kids-198487634.html
Snow Boots Waterproof Ankle Boots For Women Boots Female Wi,4384.0,7558.0,42.0,/generic-snow-boots-waterproof-ankle-boots-for-women-boots-female-wi-191434080.html
Ethnic Style Faux Leather Sheets Fish Waves Printed Synthetic Leather Fabric Roll for DIY Earrings Hair Bows Pouches,4603.0,7844.0,41.0,/generic-ethnic-style-faux-leather-sheets-fish-waves-printed-synthetic-leather-fabric-roll-for-diy-earrings-hair-bows-pouches-191390429.html
Large Size 100x137cm S Adhesive PU Leather Fabric Patch Sofa Repair  Stick-on PU Leather Fabrics Stickers Scrapbook,5402.0,9176.0,41.0,/generic-large-size-100x137cm-s-adhesive-pu-leather-fabric-patch-sofa-repair-stick-on-pu-leather-fabrics-stickers-scrapbook-192278734.html
"Tuya WiFi US Smart Light Switch Neul wire/No Neul wire Required 120 Type Wall Touch Switch Work with , Google Home",2516.0,4292.0,41.0,/generic-tuya-wifi-us-smart-light-switch-neul-wireno-neul-wire-required-120-type-wall-touch-switch-work-with-google-home-192251383.html
Tuya WiFi Smart Light Switch With Neul Wire 1 2 3 4 Gang Touch Sensor Smart Wall Switch Voice Control Google Home,3404.0,5772.0,41.0,/generic-tuya-wifi-smart-light-switch-with-neul-wire-1-2-3-4-gang-touch-sensor-smart-wall-switch-voice-control-google-home-192249528.html
Foxnovo 06221 Waterproof Fashionable Pulse Heart Rate Calorie Counter Sports Digital Watch With Date /Alarm /Stopwatch Black,2208.0,4335.0,49.0,/generic-foxnovo-06221-waterproof-fashionable-pulse-heart-rate-calorie-counter-sports-digital-watch-with-date-alarm-stopwatch-black-192399531.html
Lancol 12V Car Motorcycle Battery Tester SAE CCA JIS Digital,6495.0,12990.0,50.0,/lancol-12v-car-motorcycle-battery-tester-sae-cca-jis-digital-192085098.html
"NUBWO N13 Heavy Bass Gaming Headphone With Microphone, Cable Length:1.6m",8235.0,16388.0,50.0,/generic-nubwo-n13-heavy-bass-gaming-headphone-with-microphone-cable-length1.6m-192194526.html
Mobile Phone Cover Anti-scratch Soft TPU Water Drop Leaf,970.0,1930.0,50.0,/generic-mobile-phone-cover-anti-scratch-soft-tpu-water-drop-leaf-191571630.html
12cm*26cm*5cm Fruts Portable Shoulder Sp Lanyard vel Storage Bag For Nntendo Swtch Game Console Box Shell Cover Case,3848.0,6512.0,41.0,/generic-12cm26cm5cm-fruts-portable-shoulder-sp-lanyard-vel-storage-bag-for-nntendo-swtch-game-console-box-shell-cover-case-192761368.html
Outdoor 300ml Camping Anodized Aluminum Water Cup With,930.0,1770.0,47.0,/generic-outdoor-300ml-camping-anodized-aluminum-water-cup-with-192548231.html
Cross Line Laser Level With Bracket 15M/ 49FT Self Leveling,4778.0,8601.0,44.0,/generic-cross-line-laser-level-with-bracket-15m-49ft-self-leveling-192056586.html
Fleece Hair Drying Caps Head Towel Hair Turban,1280.0,2559.0,50.0,/generic-fleece-hair-drying-caps-head-towel-hair-turban-191607580.html
3L Salad Spinner Manual Lettuce Spinner Fruits And,5880.0,11750.0,50.0,/generic-3l-salad-spinner-manual-lettuce-spinner-fruits-and-191511511.html
915 Generation For Eve Plus Sweeper Robot Vacuum Cleaner AC Fan Component,17227.0,32732.0,47.0,/915-generation-for-eve-plus-sweeper-robot-vacuum-cleaner-ac-fan-component-130099149.html
Autumn Fall Flowers Floral Printed Faux Leather Sheets Synthetic Leather Fabric Roll for DIY Earrings Hair Bows Crafts,4603.0,7844.0,41.0,/generic-autumn-fall-flowers-floral-printed-faux-leather-sheets-synthetic-leather-fabric-roll-for-diy-earrings-hair-bows-crafts-191389977.html
2x Eid Moon Star Candlestick Ornament Decor Holder For,1628.0,2563.0,36.0,/generic-2x-eid-moon-star-candlestick-ornament-decor-holder-for-191316877.html
Laptop Case Shockproof Shoulder Bag For MacBook Pro 14 M1 Air 13 Dell Lenovo HP Acer Messenger Handbag Briefcase for Men Women,6231.0,10656.0,42.0,/generic-laptop-case-shockproof-shoulder-bag-for-macbook-pro-14-m1-air-13-dell-lenovo-hp-acer-messenger-handbag-briefcase-for-men-women-193276338.html
Mini WiFi Action Camera 1080P 30fps Digital Video Camera,3120.0,5930.0,47.0,/generic-mini-wifi-action-camera-1080p-30fps-digital-video-camera-192581605.html
For HP 15S-FQ 15S-FR 15S-EQ 15-EF 15-ER 15-DY TPN-Q222 Q230 LCD Back Cover Bezel Palmrest Botttom Case L63603-001 L63590-001,29052.0,50024.0,42.0,/generic-for-hp-15s-fq-15s-fr-15s-eq-15-ef-15-er-15-dy-tpn-q222-q230-lcd-back-cover-bezel-palmrest-botttom-case-l63603-001-l63590-001-191412585.html
Portable USB Rechargeable Fan Mini Air Cooler Office Home Outdoor Hanging Neck Fan Summer Cool  Desktop Adjustable Fan,3641.0,6216.0,41.0,/generic-portable-usb-rechargeable-fan-mini-air-cooler-office-home-outdoor-hanging-neck-fan-summer-cool-desktop-adjustable-fan-193245449.html
Fashion Luxury Men's Women Square Polarized Sungles For Men er Vintage Driving Sun Gles Male UV400 Man Eyewear,2990.0,5032.0,41.0,/fashion-luxury-mens-women-square-polarized-sungles-for-men-er-vintage-driving-sun-gles-male-uv400-man-eyewear-192061779.html
Men's Women's Fashion Cool Dog Tag Pendants Beaded Necklace-,283.0,488.0,42.0,/generic-mens-womens-fashion-cool-dog-tag-pendants-beaded-necklace-192488657.html
Cute Cartoon Soft Thumb Stick Cap Protective Cover For Nintendo Switch NS Lite Oled Joy-con Controller Thumbstick Case,2516.0,4292.0,41.0,/generic-cute-cartoon-soft-thumb-stick-cap-protective-cover-for-nintendo-switch-ns-lite-oled-joy-con-controller-thumbstick-case-192755275.html
Neoprene Diving Scuba Boots 3mm Surfing Snorkeling Socks Black XS,1870.0,3739.0,50.0,/generic-neoprene-diving-scuba-boots-3mm-surfing-snorkeling-socks-black-xs-191516862.html
24 Pieces Blue Essential Oils Bottles With Dropper - 30ml,9050.0,18099.0,50.0,/generic-24-pieces-blue-essential-oils-bottles-with-dropper-30ml-191501840.html
Silicone Case for Teclast M18 10.8 Inch Tablet Case,2347.0,4695.0,50.0,/generic-silicone-case-for-teclast-m18-10.8-inch-tablet-case-190752387.html
10Inch LED Ring Light Professional Camera Tripod Phone Stand,2500.0,4990.0,50.0,/generic-10inch-led-ring-light-professional-camera-tripod-phone-stand-191439258.html
Mini tripod for mobile phone Gopro action camera Smartphone handheld tripod,636.0,1080.0,41.0,/generic-mini-tripod-for-mobile-phone-gopro-action-camera-smartphone-handheld-tripod-191111520.html
LED Clip On Book Light Table Desk Lamp For Bedroom Bedside Study Blue,2200.0,4399.0,50.0,/generic-led-clip-on-book-light-table-desk-lamp-for-bedroom-bedside-study-blue-191564810.html
24V Truck Lights LED Strips DRL Brake Warning Driving Lights Bar Car Atmosphere Lamp Exterior Decoration Ambient Light,2930.0,5032.0,42.0,/generic-24v-truck-lights-led-strips-drl-brake-warning-driving-lights-bar-car-atmosphere-lamp-exterior-decoration-ambient-light-192313238.html
For Mitsubishi Outlander Car Accessories Car door Sill light logo lamp Power Moving LED Welcome Pedal,10715.0,18352.0,42.0,/generic-for-mitsubishi-outlander-car-accessories-car-door-sill-light-logo-lamp-power-moving-led-welcome-pedal-192308532.html
Suitable for Mercedes Benz Tailsticker V12BITURBO Fender Badge V8 BITURBO Twin-Turbocharged ABS Letter 4MATIC+TURBO Label black,4706.0,7992.0,41.0,/generic-suitable-for-mercedes-benz-tailsticker-v12biturbo-fender-badge-v8-biturbo-twin-turbocharged-abs-letter-4maticturbo-label-black-192429139.html
Case For Toshiba P55-A P55T-A P55t-A5202 LCD Back Cover Bezel Palmrest Upper Bottom Base Hinges,18781.0,32264.0,42.0,/generic-case-for-toshiba-p55-a-p55t-a-p55t-a5202-lcd-back-cover-bezel-palmrest-upper-bottom-base-hinges-191613615.html
LCD Back Cover Bottom Case for DELL Latitude 5410 5411 5420 5421 5430 5431 5440 0NKPM7 0W819 03WJ32 0DGWMV 0DW98X,10286.0,17612.0,42.0,/generic-lcd-back-cover-bottom-case-for-dell-latitude-5410-5411-5420-5421-5430-5431-5440-0nkpm7-0w819-03wj32-0dgwmv-0dw98x-191412131.html
Fashion Leotard Ballet Dancing Costumes,7300.0,8100.0,10.0,/fashion-leotard-ballet-dancing-costumes-192111883.html
Multifunctional Zipper Horizontal Flip Leather Case For IPhone 14(Red),2000.0,3999.0,50.0,/generic-multifunctional-zipper-horizontal-flip-leather-case-for-iphone-14red-191565796.html
1 Pair Of Pull Hook Heart-shaped Magnetic Couple Necklace,592.0,984.0,40.0,/generic-1-pair-of-pull-hook-heart-shaped-magnetic-couple-necklace-191143254.html
Vietnam Placer Gold Sansheng Flower Necklace Women's Gold Integrated Chain Flowers like Brocade Set Chain All-Matching Graceful Clavicle Chain,3404.0,3996.0,15.0,/generic-vietnam-placer-gold-sansheng-flower-necklace-womens-gold-integrated-chain-flowers-like-brocade-set-chain-all-matching-graceful-clavicle-chain-191139075.html
2023 Summer Female Casual Cartoon Pajama Sets Ladies Cotton Sleepwear Suit Women Short Sleeve O-Neck Collar T Shirt Shorts,5760.0,9792.0,41.0,/generic-2023-summer-female-casual-cartoon-pajama-sets-ladies-cotton-sleepwear-suit-women-short-sleeve-o-neck-collar-t-shirt-shorts-185967083.html
"RCmall 2.4"" ESP32 Module WIFI+BT Development Board 240*320 ESP32 Display Screen LCD TFT Module Capacitive Touch ESP32-2432S024C",5224.0,8880.0,41.0,/generic-rcmall-2.4-esp32-module-wifibt-development-board-240320-esp32-display-screen-lcd-tft-module-capacitive-touch-esp32-2432s024c-191671346.html
5 Pack Halloween Flame Ghost Ring Games Toys Halloween,2960.0,4906.0,40.0,/generic-5-pack-halloween-flame-ghost-ring-games-toys-halloween-191270978.html
L Shape Right Angle Corner Clamp Woodworking Square Tool 150mm Plastic,592.0,984.0,40.0,/generic-l-shape-right-angle-corner-clamp-woodworking-square-tool-150mm-plastic-191273836.html
Kids Wooden Clock Shape Sorting Educational Preschool Puzzle Blocks Toddler Toy,5328.0,7992.0,33.0,/generic-kids-wooden-clock-shape-sorting-educational-preschool-puzzle-blocks-toddler-toy-191060516.html
Glasses Pouch PU Leather Slim Strap Design Spectacles Storage Black,592.0,984.0,40.0,/generic-glasses-pouch-pu-leather-slim-strap-design-spectacles-storage-black-191642805.html
For HP 15S-FQ 15S-FR 15S-EQ 15-EF 15-ER 15-DY TPN-Q222 Q230 LCD Back Cover Bezel Palmrest Botttom Case L63603-001 L63590-001,29052.0,50024.0,42.0,/generic-for-hp-15s-fq-15s-fr-15s-eq-15-ef-15-er-15-dy-tpn-q222-q230-lcd-back-cover-bezel-palmrest-botttom-case-l63603-001-l63590-001-191417359.html
100pcs/lot 16*25cm Clear Resealable Cellophane/bop,3590.0,5990.0,40.0,/generic-100pcslot-1625cm-clear-resealable-cellophanebop-192310848.html
