item_name,current_price,old_price_element,item_discount_element,item_link
4pcs 56mm 60mm 62mm 65mm 68mm Auto Rims Cover Dust-Proof Emblem Logo Wheel Center Sticker Hub Caps Badge Decal Car Styling,2960.0,5032.0,41.0,/generic-4pcs-56mm-60mm-62mm-65mm-68mm-auto-rims-cover-dust-proof-emblem-logo-wheel-center-sticker-hub-caps-badge-decal-car-styling-192442774.html
Car Sticker M Grand Touring S EXCALIBUR 60th Anniversary Black White Edition Logo Badge Emblem For Land Cruiser HighLander,4440.0,7548.0,41.0,/generic-car-sticker-m-grand-touring-s-excalibur-60th-anniversary-black-white-edition-logo-badge-emblem-for-land-cruiser-highlander-192431506.html
1Pcs Universal Stylus With Stents For ZHONGHUA206 Retro Phonograph LP Turntable Vinyl Record Player Accessories,4692.0,7992.0,41.0,/generic-1pcs-universal-stylus-with-stents-for-zhonghua206-retro-phonograph-lp-turntable-vinyl-record-player-accessories-191199918.html
1Pcs Turntable Universal Headshell Stylus Holder For LP Vinyl Pickup Record Player Phonograph Support Accessories,4810.0,8288.0,42.0,/generic-1pcs-turntable-universal-headshell-stylus-holder-for-lp-vinyl-pickup-record-player-phonograph-support-accessories-191199976.html
G20 Wired 3.5mm Plug Dynamic Gaming Earphones With-Red,570.0,855.0,33.0,/generic-g20-wired-3.5mm-plug-dynamic-gaming-earphones-with-red-192383388.html
2019 Newest Formal Office Leather Shoes -Yellow,2216.0,3697.0,40.0,/generic-2019-newest-formal-office-leather-shoes-yellow-191827957.html
LI-3110 Ultrasonic Electronic Rat Repeller US Plug(White),999.0,1427.0,30.0,/generic-li-3110-ultrasonic-electronic-rat-repeller-us-plugwhite-192076324.html
For Mercedes Benz S cl w222 s300h s350 s400 s550L s63L Car LED Door Shadow Light Welcome Laser Logo Lamps Kit,15007.0,25752.0,42.0,/generic-for-mercedes-benz-s-cl-w222-s300h-s350-s400-s550l-s63l-car-led-door-shadow-light-welcome-laser-logo-lamps-kit-192309157.html
Nylon Cleaning Brush Coffee hine Brush 1PC Espresso  hine Group Head Bristle Spoon Home Appliance Parts Kitchen,2515.0,4292.0,41.0,/generic-nylon-cleaning-brush-coffee-hine-brush-1pc-espresso-hine-group-head-bristle-spoon-home-appliance-parts-kitchen-185870656.html
Pro Portable   Steel Comb Eyelash Extension,740.0,1181.0,37.0,/generic-pro-portable-steel-comb-eyelash-extension-191780193.html
for IC300 IZ102 IZ101 SimbaII Vacuum Cleaner Rolling Brush,3546.0,7092.0,50.0,/generic-for-ic300-iz102-iz101-simbaii-vacuum-cleaner-rolling-brush-191860953.html
Modified  Rear Top Box Base Support Board Luggage,7252.0,11939.0,39.0,/generic-modified-rear-top-box-base-support-board-luggage-191939138.html
50 Pcs/lot Eva Sponge Balls Kits Diy Room Decoration Background Photography Props For Cosmetics Shoot Children Pet Ball Toy,2683.0,4561.0,41.0,/generic-50-pcslot-eva-sponge-balls-kits-diy-room-decoration-background-photography-props-for-cosmetics-shoot-children-pet-ball-toy-185864002.html
Fashion Bodysuit Dancewear Dance Costume,5000.0,5500.0,9.0,/fashion-bodysuit-dancewear-dance-costume-192111833.html
Case for Huawei MateBook 13 14 D14 D15  Matte BalLaptop Hard Shell for Mate Book X Pro 13.9/X Protective Cover,3966.0,6808.0,42.0,/generic-case-for-huawei-matebook-13-14-d14-d15-matte-ballaptop-hard-shell-for-mate-book-x-pro-13.9x-protective-cover-193239933.html
Clear Phone Case For Xiaomi Redmi Note 12 4G,399.0,570.0,30.0,/generic-clear-phone-case-for-xiaomi-redmi-note-12-4g-192020120.html
5.0 Wireless Universal Bluetooth-compatible Sport-White,491.0,737.0,33.0,/generic-5.0-wireless-universal-bluetooth-compatible-sport-white-192369720.html
Ultra-thin Soft Liquid Silicone Rubber Buffer Cover For Iphone13mini,870.0,1739.0,50.0,/generic-ultra-thin-soft-liquid-silicone-rubber-buffer-cover-for-iphone13mini-191473860.html
Charging Port Board For Umidigi Bison X10,2500.0,4990.0,50.0,/generic-charging-port-board-for-umidigi-bison-x10-191551335.html
Fashion Sexy Knight Female 8 Inch High Heel Platform Ankle,10452.0,18020.0,42.0,/generic-fashion-sexy-knight-female-8-inch-high-heel-platform-ankle-191438988.html
Womens Pleated Skirt Slim High Waist Mini Black Cross Print Skirts Gothic Style,2254.0,2779.0,19.0,/generic-womens-pleated-skirt-slim-high-waist-mini-black-cross-print-skirts-gothic-style-196958991.html
Cartoon Wall Stickers For Kids Room Nordic Giraffe,892.0,1535.0,42.0,/generic-cartoon-wall-stickers-for-kids-room-nordic-giraffe-98006159.html
"HSS Drill Bits Countersink Drill Bits For Steel Metal, , Alum, Ect",888.0,1409.0,37.0,/generic-hss-drill-bits-countersink-drill-bits-for-steel-metal-alum-ect-191134084.html
915 Generation Portable Electric Lint Remover Sweater Trimmer Rechargeable,3616.0,6870.0,47.0,/915-generation-portable-electric-lint-remover-sweater-trimmer-rechargeable-129882913.html
LED Ceiling Light Minimalist Multicolor Ul-thin Round Lamp Nodic For Living Room Bedroom Study Aisle Balcony Lighting Fixture,20202.0,34780.0,42.0,/generic-led-ceiling-light-minimalist-multicolor-ul-thin-round-lamp-nodic-for-living-room-bedroom-study-aisle-balcony-lighting-fixture-192147951.html
Pack Of 3 Bowknot Shape No Bend Hair Clips Seamless Hairdressing Pink,870.0,1739.0,50.0,/generic-pack-of-3-bowknot-shape-no-bend-hair-clips-seamless-hairdressing-pink-191496245.html
Portable Tattoo Machine Holder Organizer Case Box For Rubber Pink,920.0,1839.0,50.0,/generic-portable-tattoo-machine-holder-organizer-case-box-for-rubber-pink-191508744.html
Loudspeaker For Samsung Galaxy S10 Lite 5G S10e S9 S8 Plus S7 S6 Edge Note 9 8 5 Loud,1215.0,2100.0,42.0,/generic-loudspeaker-for-samsung-galaxy-s10-lite-5g-s10e-s9-s8-plus-s7-s6-edge-note-9-8-5-loud-192717120.html
Reptile Hide Bed Warm Mat Tent For Hamster Play Toys Green Cat,2630.0,5259.0,50.0,/generic-reptile-hide-bed-warm-mat-tent-for-hamster-play-toys-green-cat-204914485.html
4WD car logo suitable for hyundai IX25 IX35 Tucson Santafe personality four-wheel drive tail label stickers Trunk letter,2871.0,4884.0,41.0,/generic-4wd-car-logo-suitable-for-hyundai-ix25-ix35-tucson-santafe-personality-four-wheel-drive-tail-label-stickers-trunk-letter-192442141.html
Turntable Universal Metal Balanced Disc Stabilizer For LP Vinyl Record Player Phonograph Balanced Weight Clamp Accessories,5284.0,9028.0,41.0,/generic-turntable-universal-metal-balanced-disc-stabilizer-for-lp-vinyl-record-player-phonograph-balanced-weight-clamp-accessories-191197398.html
Youpin Cleaning Brush Outdoor Barbecue Grill Spiral Brush Exhaust Fan Stove Air Outlet Cleaning Brush,3448.0,5862.0,41.0,/generic-youpin-cleaning-brush-outdoor-barbecue-grill-spiral-brush-exhaust-fan-stove-air-outlet-cleaning-brush-187836048.html
Metallic Paint Hybrid PC Phone Case For IPhone 12 Pro Max,399.0,570.0,30.0,/generic-metallic-paint-hybrid-pc-phone-case-for-iphone-12-pro-max-190977769.html
Brushed Texture Carbon Fiber TPU Case For Nokia 2.2,399.0,570.0,30.0,/generic-brushed-texture-carbon-fiber-tpu-case-for-nokia-2.2-191684491.html
Fashion Girls' Clothing Children's Party Dress,3100.0,3400.0,9.0,/fashion-girls-clothing-childrens-party-dress-191873940.html
Casual Canvas Crossbody Bag Unisex Small Shoulder Handbag Solid Canvas Mobile Phone Bags Femal XXA,3694.0,4621.0,20.0,/generic-casual-canvas-crossbody-bag-unisex-small-shoulder-handbag-solid-canvas-mobile-phone-bags-femal-xxa-191089767.html
For PS5 Disk Edition Carbon Fiber Skin Sticker Decal Cover for PlayStation5 Console Disc Center Protective Skin Game Accessories,2531.0,4292.0,41.0,/generic-for-ps5-disk-edition-carbon-fiber-skin-sticker-decal-cover-for-playstation5-console-disc-center-protective-skin-game-accessories-192894152.html
GTA design For PS4 Console and Controllers stickers for ps4 skin sticker for PS4 vinyl sticker for PS4 pvc skin sticker,3448.0,5920.0,42.0,/generic-gta-design-for-ps4-console-and-controllers-stickers-for-ps4-skin-sticker-for-ps4-vinyl-sticker-for-ps4-pvc-skin-sticker-191835395.html
Sealed Waterproof Soap Dish Gym School Blue Pink,1260.0,2519.0,50.0,/generic-sealed-waterproof-soap-dish-gym-school-blue-pink-191470963.html
Large Gaming Mousepads Print Stream Mouse Pad Computer Mousepad CSGO Mouse Mat 90x40cm Desk Pads For PC Keyboard Mats Table Rug,5114.0,8704.0,41.0,/generic-large-gaming-mousepads-print-stream-mouse-pad-computer-mousepad-csgo-mouse-mat-90x40cm-desk-pads-for-pc-keyboard-mats-table-rug-203337457.html
TPU Phone Case For Huawei Nova 5z,391.0,562.0,30.0,/generic-tpu-phone-case-for-huawei-nova-5z-192404767.html
Outdoor Dynamic  Universal Silicone Elastic Bicycle Motorcycle Bike Mount Holder For Mobile Phone  HOT NEW  AUGUST14(A),2540.0,5070.0,50.0,/generic-outdoor-dynamic-universal-silicone-elastic-bicycle-motorcycle-bike-mount-holder-for-mobile-phone-hot-new-august14a-191489120.html
Treadmill Cover For Non-Folding Home Running Silver_168x76x140cm,4412.0,5738.0,23.0,/generic-treadmill-cover-for-non-folding-home-running-silver168x76x140cm-191760336.html
25W Fast Charger For Samsung Galaxy A34 With USB Type C To Type C Cable,2000.0,2500.0,20.0,/generic-25w-fast-charger-for-samsung-galaxy-a34-with-usb-type-c-to-type-c-cable-191178585.html
Women's Ankel Boots Autumn Winter Women Boots Womens Short,3965.0,5830.0,32.0,/generic-womens-ankel-boots-autumn-winter-women-boots-womens-short-191440284.html
Women Quick Dry Wearable Fiber Plush Bathrobes Bath Towel Spa Green 2,3670.0,7339.0,50.0,/generic-women-quick-dry-wearable-fiber-plush-bathrobes-bath-towel-spa-green-2-191591246.html
for XiaoMi Roborock S6 S60 S65 S5 MAX T6 Accessories Vacuum,3157.0,6314.0,50.0,/generic-for-xiaomi-roborock-s6-s60-s65-s5-max-t6-accessories-vacuum-191039055.html
2pcs USB Rechargeable For Seat Ibiza Leon Ateca Logo Car Door HD LED Lamps Courtesy Welcome Lights,5210.0,8880.0,41.0,/generic-2pcs-usb-rechargeable-for-seat-ibiza-leon-ateca-logo-car-door-hd-led-lamps-courtesy-welcome-lights-192314537.html
915 Generation Universal Motorcycle Accessory Tuning Parts Chain Adjuster,1677.0,3186.0,47.0,/915-generation-universal-motorcycle-accessory-tuning-parts-chain-adjuster-129432501.html
Andoer Dual USB  Adpater  Coupler Replacement DR-E17 Dummy,1548.0,2787.0,44.0,/andoer-dual-usb-adpater-coupler-replacement-dr-e17-dummy-192047270.html
"Power Adapter Suitable For Dyson Vacuum Cleaner, US Plug",1899.0,2712.0,30.0,/generic-power-adapter-suitable-for-dyson-vacuum-cleaner-us-plug-191866706.html
2Pcs Outdoor Foldable Collapsible Drinking Water Container,3256.0,5301.0,39.0,/generic-2pcs-outdoor-foldable-collapsible-drinking-water-container-191793253.html
10Pcs For ad 9 10.2 2021 Touch Screen  GlA2602 A2603 A2604 A2605 with Home on+ Cable+Camera Holder,12269.0,21016.0,42.0,/generic-10pcs-for-ad-9-10.2-2021-touch-screen-gla2602-a2603-a2604-a2605-with-home-on-cablecamera-holder-191370872.html
Fanzhuan Free Shipping New Pants Male Man 2018 Men's Trousers Casual Yong Embroidered Pants Black Spring 818001,7499.0,12749.0,41.0,/generic-fanzhuan-free-shipping-new-pants-male-man-2018-mens-trousers-casual-yong-embroidered-pants-black-spring-818001-187493299.html
Large Size 100x137cm S Adhesive PU Leather Fabric Patch Sofa Repair  Stick-on PU Leather Fabrics Stickers Scrapbook,5402.0,9176.0,41.0,/generic-large-size-100x137cm-s-adhesive-pu-leather-fabric-patch-sofa-repair-stick-on-pu-leather-fabrics-stickers-scrapbook-191455189.html
"Wood Rolling Pin  For Hapati, Pasta, Bakery, Pizza C",1184.0,1968.0,40.0,/generic-wood-rolling-pin-for-hapati-pasta-bakery-pizza-c-191646984.html
Motorbike 48mm Exhaust Can Pipe DB Killer Insert Baffle Muffler,1332.0,2121.0,37.0,/generic-motorbike-48mm-exhaust-can-pipe-db-killer-insert-baffle-muffler-191429847.html
Matte Black Letters C180 C200 C220d C250d C260 C300d 4Matic ABS Emblem for Mercedes Benz W205 Coupe Car Trunk Logo Sticker,4603.0,7844.0,41.0,/generic-matte-black-letters-c180-c200-c220d-c250d-c260-c300d-4matic-abs-emblem-for-mercedes-benz-w205-coupe-car-trunk-logo-sticker-192432245.html
for HP 15-DY 15T-DY 15-EF 15S-EQ 15s-FQ TPN-Q222 EA0P5002010 laptop LCD Back Cover Front Bezel Palmrest Upper BOTTOM CASE,15229.0,26196.0,42.0,/generic-for-hp-15-dy-15t-dy-15-ef-15s-eq-15s-fq-tpn-q222-ea0p5002010-laptop-lcd-back-cover-front-bezel-palmrest-upper-bottom-case-191420103.html
laptop parts Case for Mac Book Air 11 A1465 air 13 13.3 inch A1466 pro 13 A1706 with 13 CD ROM A1278 retina 13 A1502 Laptop Case,5284.0,9028.0,41.0,/generic-laptop-parts-case-for-mac-book-air-11-a1465-air-13-13.3-inch-a1466-pro-13-a1706-with-13-cd-rom-a1278-retina-13-a1502-laptop-case-193252148.html
Phone Case Full Coverage Illustrated Girl Pattern-Rose Red,970.0,1930.0,50.0,/generic-phone-case-full-coverage-illustrated-girl-pattern-rose-red-191589475.html
Adjustable Opening Women Engagement Wedding Ring For Couple,1036.0,1647.0,37.0,/generic-adjustable-opening-women-engagement-wedding-ring-for-couple-191344491.html
Adjustable Opening Women Engagement Wedding Ring For Couple,1036.0,1647.0,37.0,/generic-adjustable-opening-women-engagement-wedding-ring-for-couple-191527000.html
Fashion Clic Polarized Sungles Men er Vintage Driving Pilot Sungl Man Eyewear Sun Gles UV400 Oculos De Sol,3848.0,6512.0,41.0,/fashion-clic-polarized-sungles-men-er-vintage-driving-pilot-sungl-man-eyewear-sun-gles-uv400-oculos-de-sol-192097225.html
Front Bumper Tow Hook Cap Towing Eye Cover For Nissan Qashqai J10 2007-2010 622A0-JD001 622A0JD001 Car Accessories,3818.0,6512.0,41.0,/generic-front-bumper-tow-hook-cap-towing-eye-cover-for-nissan-qashqai-j10-2007-2010-622a0-jd001-622a0jd001-car-accessories-192461531.html
Acara LS Engine Valve Spring Compressor Tool for LS1 LS2 LS3 LS6 LSX LQ4 LQ9 48 53 57 60 62 Car AccessoriesBlack,1823.0,3646.0,50.0,/acara-ls-engine-valve-spring-compressor-tool-for-ls1-ls2-ls3-ls6-lsx-lq4-lq9-48-53-57-60-62-car-accessoriesblack-84089338.html
For Lenovo ThinkPad L380 L390 Yoga LCD Back Cover Bezel 95 Palmrest Upper Case Bottom Base Cover,9650.0,16576.0,42.0,/generic-for-lenovo-thinkpad-l380-l390-yoga-lcd-back-cover-bezel-95-palmrest-upper-case-bottom-base-cover-191419540.html
Phone Holder Strong Bearing Capacity Stretchable Desk-Green,1030.0,2050.0,50.0,/generic-phone-holder-strong-bearing-capacity-stretchable-desk-green-191511586.html
Shower Phone Box Multifunctional 360 Degree Rotation-White,1480.0,2950.0,50.0,/generic-shower-phone-box-multifunctional-360-degree-rotation-white-191607475.html
Diagonal Stripe Soft Leather Case Soft PU For IPhone7Plus/8Plus,968.0,1853.0,48.0,/generic-diagonal-stripe-soft-leather-case-soft-pu-for-iphone7plus8plus-191321896.html
Men Wrist Watch Mens Watches Top Brand Luxury Watch Diamond Clock Automatic Date,2220.0,3586.0,38.0,/generic-men-wrist-watch-mens-watches-top-brand-luxury-watch-diamond-clock-automatic-date-191622387.html
Diamonds Women Girls Ladies Gold Bracelet Wrist Watches,1036.0,1675.0,38.0,/generic-diamonds-women-girls-ladies-gold-bracelet-wrist-watches-192316989.html
Cute Candy Bag Convenient Non Woven Fabric Christmas,496.0,744.0,33.0,/generic-cute-candy-bag-convenient-non-woven-fabric-christmas-192371144.html
20*33cm Solid Color Dots Printed Faux Leather Sheets Synthetic Leather Material For Bow DIY Bag Shoes Handmade Craft Vinyl,2516.0,4292.0,41.0,/generic-2033cm-solid-color-dots-printed-faux-leather-sheets-synthetic-leather-material-for-bow-diy-bag-shoes-handmade-craft-vinyl-191397500.html
4D Eyeball Aluminum Film Balloons Realistic Modeling For,3256.0,4884.0,33.0,/generic-4d-eyeball-aluminum-film-balloons-realistic-modeling-for-191080815.html
"2pcs Wallpaper Seam Roller Hand Pressure Roll DIY  Tools, Seam",740.0,1132.0,35.0,/generic-2pcs-wallpaper-seam-roller-hand-pressure-roll-diy-tools-seam-191663099.html
Lexar NM100 128GB M.2 SATA III Solid State Drive Internal,4282.0,7708.0,44.0,/lexar-nm100-128gb-m.2-sata-iii-solid-state-drive-internal-191161786.html
Replacement Longboard Nose Tail Deck Guard 30cm White,1490.0,2979.0,50.0,/generic-replacement-longboard-nose-tail-deck-guard-30cm-white-191507791.html
16G 1080P Hidden Camera Watch IR Night Vision DV DVR Video Recorder Wrist Watch Leather Leather,9741.0,19401.0,50.0,/generic-16g-1080p-hidden-camera-watch-ir-night-vision-dv-dvr-video-recorder-wrist-watch-leather-leather-191244241.html
Fashion 24mm Oil Wax Leather Smart Watch Band Strap-Brown,1008.0,1513.0,33.0,/fashion-24mm-oil-wax-leather-smart-watch-band-strap-brown-192360316.html
Men's Swimming Trunks Y Swimwear Men Swimming Shorts MenRed L,2167.0,3740.0,42.0,/generic-mens-swimming-trunks-y-swimwear-men-swimming-shorts-menred-l-191064020.html
Ull Thin Wood Led Ceiling Lamp 15W 48W Modern led Ceiling lights lighting For led Living Room Ceiling Light Kitchen Fixtures,34987.0,60236.0,42.0,/generic-ull-thin-wood-led-ceiling-lamp-15w-48w-modern-led-ceiling-lights-lighting-for-led-living-room-ceiling-light-kitchen-fixtures-192133317.html
Creative Mini Portable Micro USB Fan 5v 1w Mobile Phone USB Gadget Fans  For Type-C Type C USB-C,3315.0,5624.0,41.0,/generic-creative-mini-portable-micro-usb-fan-5v-1w-mobile-phone-usb-gadget-fans-for-type-c-type-c-usb-c-190765771.html
Colorful USB LED Cup Holder Car Coaster Bottle Atmosphere 7 Colors Light Lamp Constellation Luminous Backlight Gl Tumbler Pad,2649.0,4440.0,40.0,/generic-colorful-usb-led-cup-holder-car-coaster-bottle-atmosphere-7-colors-light-lamp-constellation-luminous-backlight-gl-tumbler-pad-190688881.html
Andoer HD-M3X Pro 16in Desktop LED Video Light Half-moon,9140.0,17370.0,47.0,/andoer-hd-m3x-pro-16in-desktop-led-video-light-half-moon-192563851.html
Andoer Tripod Ball Head 360 Degree Swivel Compatible With,987.0,1777.0,44.0,/andoer-tripod-ball-head-360-degree-swivel-compatible-with-192047265.html
PC HDTV Monitor Full HD Devices PAL 480i,1036.0,1638.0,37.0,/generic-pc-hdtv-monitor-full-hd-devices-pal-480i-191780319.html
Front Housing LCD Frame Bezel Plate For Xiaomi Redmi Note 11 Pro / Redmi Note 11 Pro+(Purple),2830.0,5650.0,50.0,/generic-front-housing-lcd-frame-bezel-plate-for-xiaomi-redmi-note-11-pro-redmi-note-11-propurple-191522937.html
Fashion Girls' Clothing Children's Party Dress,3100.0,3400.0,9.0,/fashion-girls-clothing-childrens-party-dress-191873772.html
915 Generation for Tesla Model 3 Air-Filter HEPA with Activated Carbon,4316.0,7985.0,46.0,/915-generation-for-tesla-model-3-air-filter-hepa-with-activated-carbon-128241944.html
4WD car logo suitable for hyundai IX25 IX35 Tucson Santafe personality four-wheel drive tail label stickers Trunk letter,2871.0,4884.0,41.0,/generic-4wd-car-logo-suitable-for-hyundai-ix25-ix35-tucson-santafe-personality-four-wheel-drive-tail-label-stickers-trunk-letter-192442874.html
Car Rearview Mirror Rain Eyebrow Rain-Proof and Rain-Proof Baffle Waterproof Block Strip Reflective Rearview Mirror Window Deflectors Decorative General Products,3726.0,5184.0,28.0,/generic-car-rearview-mirror-rain-eyebrow-rain-proof-and-rain-proof-baffle-waterproof-block-strip-reflective-rearview-mirror-window-deflectors-decorative-general-products-190605239.html
Fascial Gun Massager Muscle Relax Deep Tissue 3200rmp Green,7110.0,14219.0,50.0,/generic-fascial-gun-massager-muscle-relax-deep-tissue-3200rmp-green-191503746.html
Case For Xiaomi Redmi Note 13 4G Flexible TPU Rubber Grip Shock-Absorbent Case Cover,970.0,1558.0,38.0,/generic-case-for-xiaomi-redmi-note-13-4g-flexible-tpu-rubber-grip-shock-absorbent-case-cover-190751898.html
For Tecno Spark 7 Pro Case Shockproof Bracket Phone Case,870.0,1739.0,50.0,/generic-for-tecno-spark-7-pro-case-shockproof-bracket-phone-case-191445423.html
2x Case Stand Cart For Computer Host - Heavy Duty Desktop Computer,9670.0,19339.0,50.0,/generic-2x-case-stand-cart-for-computer-host-heavy-duty-desktop-computer-191457131.html
Metallic Drive Shafts For SCX10 D90 HSP 94180 RC Car Rock Blue,740.0,1181.0,37.0,/generic-metallic-drive-shafts-for-scx10-d90-hsp-94180-rc-car-rock-blue-191768956.html
Fashion Lightweight Mens Boat Shoes Slip On Canvas Sneakers,4000.0,8000.0,50.0,/fashion-lightweight-mens-boat-shoes-slip-on-canvas-sneakers-191004062.html
WhiteNew Luxury Designer Handbag For Women Trend Armpit Baguette Bag Candy Color Female Shoulder,3125.0,3909.0,20.0,/generic-whitenew-luxury-designer-handbag-for-women-trend-armpit-baguette-bag-candy-color-female-shoulder-190568006.html
Women Fashion Shoulder Bag PU Leather Ladies Hand Bag Chain Crossbody Bags Pink,3946.0,5801.0,32.0,/generic-women-fashion-shoulder-bag-pu-leather-ladies-hand-bag-chain-crossbody-bags-pink-190601704.html
HAMTOD GT4 Pro 1.47 Inch TFT Screen Smart Watch,6808.0,11110.0,39.0,/generic-hamtod-gt4-pro-1.47-inch-tft-screen-smart-watch-202218185.html
Men Sports Harness Feet Harlan Casual Denim Pants,7539.0,14326.0,47.0,/generic-men-sports-harness-feet-harlan-casual-denim-pants-190685249.html
Kids Cartoon Pencil Case Plush Large Pen Bag Cosmetic,592.0,984.0,40.0,/generic-kids-cartoon-pencil-case-plush-large-pen-bag-cosmetic-190943858.html
"915 Generation Stainless Steel Silicone Kitchenware 2 Sets, Spatula,",1794.0,3408.0,47.0,/915-generation-stainless-steel-silicone-kitchenware-2-sets-spatula-129811524.html
51/54/58mm Stainless Steel Coffee Filter Basket For Machine Delonghi Breville CafeDripper Portafilter Coffee er Siner,2664.0,4440.0,40.0,/generic-515458mm-stainless-steel-coffee-filter-basket-for-machine-delonghi-breville-cafedripper-portafilter-coffee-er-siner-192758291.html
Waterproof Marble Wallpapers Vinyl S Adhesive for Kitchen Cabinets Desktop Wall Stickers Livingroom Home Decor Contact Paper,6334.0,10804.0,41.0,/generic-waterproof-marble-wallpapers-vinyl-s-adhesive-for-kitchen-cabinets-desktop-wall-stickers-livingroom-home-decor-contact-paper-192883703.html
Retro Punk Typewriter-Style   Keyboard Key Caps,2664.0,4285.0,38.0,/generic-retro-punk-typewriter-style-keyboard-key-caps-191284009.html
"Waterproof Brand Laptop Bag 17.3 Inch,Sleeve Case For Macbook Notebook Computer PC Dell Lenovo Asus Man Lady Women DropShip H301",5210.0,8880.0,41.0,/generic-waterproof-brand-laptop-bag-17.3-inchsleeve-case-for-macbook-notebook-computer-pc-dell-lenovo-asus-man-lady-women-dropship-h301-193266594.html
30cm 1080P HDMI Port Male To 2 Female 1 In 2 Out Splitter Cable Adapter Converter,3078.0,4212.0,27.0,/generic-30cm-1080p-hdmi-port-male-to-2-female-1-in-2-out-splitter-cable-adapter-converter-175032726.html
Portable Universal Mechanical Hand Feel Usb Wired Gaming,2013.0,3068.0,34.0,/generic-portable-universal-mechanical-hand-feel-usb-wired-gaming-191017257.html
915 Generation TELESIN GP-BCG-902 Triple Channel Battery Charger for GoPro,1794.0,3318.0,46.0,/915-generation-telesin-gp-bcg-902-triple-channel-battery-charger-for-gopro-130069341.html
Desktop live broadcast mobile phone tripod handheld stand for GoPro action camera iPhone Samsung smartphone,651.0,1095.0,41.0,/generic-desktop-live-broadcast-mobile-phone-tripod-handheld-stand-for-gopro-action-camera-iphone-samsung-smartphone-190934743.html
10.1 Inch GlFor Goodte2 Tablet PC Capacitive Touch Screen Panel Repair Replacement Good Te~2 Tab Parts r,3108.0,5328.0,42.0,/generic-10.1-inch-glfor-goodte2-tablet-pc-capacitive-touch-screen-panel-repair-replacement-good-te2-tab-parts-r-191408228.html
"915 Generation Dog Cat Bowls Double Pet Bowls, with Anti-Slip Resin",2540.0,4444.0,43.0,/915-generation-dog-cat-bowls-double-pet-bowls-with-anti-slip-resin-128956486.html
1pc Universal Anti Gravity Chair Side Bag Patio Recliner Net Dark Blue,888.0,1396.0,36.0,/generic-1pc-universal-anti-gravity-chair-side-bag-patio-recliner-net-dark-blue-192306639.html
Battery Back Cover With Camera Lens For Galaxy S10e(Black),1070.0,2139.0,50.0,/generic-battery-back-cover-with-camera-lens-for-galaxy-s10eblack-191451763.html
Touchscreen 9.7 Inch LP097QX1 SPA1 SPAV SPC1 2048x1536 EDP Signal 4es 51 Pins LCD Display Panel with DS driver Board,21171.0,36408.0,42.0,/generic-touchscreen-9.7-inch-lp097qx1-spa1-spav-spc1-2048x1536-edp-signal-4es-51-pins-lcd-display-panel-with-ds-driver-board-191366559.html
Fashion Belt Men's Business Boys Automatic Buckle Jaguar Daily Use All-Match Trousers,6417.0,9219.0,30.0,/fashion-belt-mens-business-boys-automatic-buckle-jaguar-daily-use-all-match-trousers-173490215.html
Elbow Brace Support Strap,2368.0,3755.0,37.0,/generic-elbow-brace-support-strap-192005435.html
Ghost ll PS5 Standard Disc Edition Skin Sticker Decal Cover for PlayStation 5 Console & Controllers PS5 Skin Sticker Vinyl,4307.0,7400.0,42.0,/generic-ghost-ll-ps5-standard-disc-edition-skin-sticker-decal-cover-for-playstation-5-console-controllers-ps5-skin-sticker-vinyl-191836332.html
Grwibeou DisplayPort Display Port DP To VGA Adapter Cable Male To Female Converter For PC Computer Laptop HDTV Monitor Projector-,4724.0,6681.0,29.0,/generic-grwibeou-displayport-display-port-dp-to-vga-adapter-cable-male-to-female-converter-for-pc-computer-laptop-hdtv-monitor-projector-175032223.html
Portable 2.4g Wireless Digital Keyboard Usb Number Pad 18,4094.0,8193.0,50.0,/generic-portable-2.4g-wireless-digital-keyboard-usb-number-pad-18-190775825.html
TPU Phone Case With Ring For Xiaomi Redmi Note 13 Pro 4G,499.0,712.0,30.0,/generic-tpu-phone-case-with-ring-for-xiaomi-redmi-note-13-pro-4g-191999205.html
G9 2G Kids Smart Watch Alarm  Clock 16 Puzzle Games,4070.0,8130.0,50.0,/generic-g9-2g-kids-smart-watch-alarm-clock-16-puzzle-games-191496520.html
Diaper Bag Backpack With Changing Station Diaper Bag For Baby Boys Girls With Foldable Travel Bed Large Capacity Waterproof,10212.0,15244.0,33.0,/generic-diaper-bag-backpack-with-changing-station-diaper-bag-for-baby-boys-girls-with-foldable-travel-bed-large-capacity-waterproof-190817547.html
For Acer A515-51 A515 A615-51 A315-53 51 33 41 n17c4 Laptop LCD Back Cover Front Bezel Hinges Palmrest Bottom Case Housing,21682.0,37296.0,42.0,/generic-for-acer-a515-51-a515-a615-51-a315-53-51-33-41-n17c4-laptop-lcd-back-cover-front-bezel-hinges-palmrest-bottom-case-housing-193243701.html
2 Pieces Waterproof Adjustable Gland Fittings,740.0,1181.0,37.0,/generic-2-pieces-waterproof-adjustable-gland-fittings-191985077.html
