item_name,current_price,old_price_element,item_discount_element,item_link
Matte Black Letters V8 Biturbo ABS Emblem for Mercedes Benz AMG C63 C63S Coupe Car Side Fender Trunk Nameplate Logo Sticker,4262.0,7252.0,41.0,/generic-matte-black-letters-v8-biturbo-abs-emblem-for-mercedes-benz-amg-c63-c63s-coupe-car-side-fender-trunk-nameplate-logo-sticker-192430273.html
Chrome Matt Gloss Black Red V8 BITURBO V8BITURBO Letters Fender Badges Embl Sticker for Mercedes Benz AMG,3123.0,5328.0,41.0,/generic-chrome-matt-gloss-black-red-v8-biturbo-v8biturbo-letters-fender-badges-embl-sticker-for-mercedes-benz-amg-192435378.html
4PCS 45mm 50mm 56mm 65mm OZ Racing RAYS Car Wheel Center Hub Cap Sticker,3478.0,5920.0,41.0,/generic-4pcs-45mm-50mm-56mm-65mm-oz-racing-rays-car-wheel-center-hub-cap-sticker-192431948.html
Laptop Bag 13 14 15 15.6 inch Handbag Women Notebook Bag For Macbook Air Pro 16 Case Xiaomi Asus PU Leather Luxury Computer Bag,4588.0,7844.0,42.0,/generic-laptop-bag-13-14-15-15.6-inch-handbag-women-notebook-bag-for-macbook-air-pro-16-case-xiaomi-asus-pu-leather-luxury-computer-bag-193290456.html
24pcs Round Head Camera Flash Gels Lighting Filters Color,912.0,1642.0,44.0,/generic-24pcs-round-head-camera-flash-gels-lighting-filters-color-192046953.html
For HP 15-DY 15-EF 15S-FQ 15S-FR 15S-EQ TPN-Q222 Q230 Palm Rest shell Keyboard upper cover case L63578-001 L63579-001,16147.0,27824.0,42.0,/generic-for-hp-15-dy-15-ef-15s-fq-15s-fr-15s-eq-tpn-q222-q230-palm-rest-shell-keyboard-upper-cover-case-l63578-001-l63579-001-191417949.html
For ASUS ZenBook 14 UX425 UX425J UX425JA U4700J Laptop LCD Screen Back Cover Front Bezel Palmrest Top Lower Bottom Case,24065.0,41440.0,42.0,/generic-for-asus-zenbook-14-ux425-ux425j-ux425ja-u4700j-laptop-lcd-screen-back-cover-front-bezel-palmrest-top-lower-bottom-case-193246938.html
Laptop Case For Huawei Matebook D14 D15 Protection Hard Shell Cover For Mate book 13s 14s xpro Honor Magicbook pro 16.1 Case,5047.0,8584.0,41.0,/generic-laptop-case-for-huawei-matebook-d14-d15-protection-hard-shell-cover-for-mate-book-13s-14s-xpro-honor-magicbook-pro-16.1-case-193256627.html
Huohou Led Portable Usb Ear Nail Care Kit Ear Pick Brush Wax Cleaner Removal Tool Kit With Led Light Nail File Clipper Cutter,5168.0,8785.0,41.0,/generic-huohou-led-portable-usb-ear-nail-care-kit-ear-pick-brush-wax-cleaner-removal-tool-kit-with-led-light-nail-file-clipper-cutter-187845281.html
Clear Phone Case For Xiaomi Redmi Note 12 Pro Speed,399.0,570.0,30.0,/generic-clear-phone-case-for-xiaomi-redmi-note-12-pro-speed-192020142.html
PUSKILL Memoria Ram 4 8GB 4GB 16GB 2400mhz 2133 2666mhz So Notebook High Performance Laptop Memory,19021.0,32708.0,42.0,/generic-puskill-memoria-ram-4-8gb-4gb-16gb-2400mhz-2133-2666mhz-so-notebook-high-performance-laptop-memory-191107352.html
915 Generation 40 Pcs Plus Fixed Angle Code Right for Outdoor Table Chair,2754.0,5178.0,47.0,/915-generation-40-pcs-plus-fixed-angle-code-right-for-outdoor-table-chair-127637470.html
Digital Camera Battery Car Charger For Canon LP-E10,1584.0,2266.0,30.0,/generic-digital-camera-battery-car-charger-for-canon-lp-e10-192426473.html
-55 Wired Game Mouse 800Dpi Desktop Laptop Optical Mouse,773.0,1553.0,50.0,/generic-55-wired-game-mouse-800dpi-desktop-laptop-optical-mouse-191246171.html
Bottle Pouch Holder Waterproof Outdoor Water Green,595.0,777.0,23.0,/generic-bottle-pouch-holder-waterproof-outdoor-water-green-191756303.html
Splatoon 3 Vinyl Screen Skin Protector Sticker for Nintendo Switch NS Console + Controller + Stand Holder Dock Skin,2768.0,4736.0,42.0,/generic-splatoon-3-vinyl-screen-skin-protector-sticker-for-nintendo-switch-ns-console-controller-stand-holder-dock-skin-192763050.html
Mini tripod for mobile phone Gopro action camera Smartphone handheld tripod,629.0,1073.0,41.0,/generic-mini-tripod-for-mobile-phone-gopro-action-camera-smartphone-handheld-tripod-192344448.html
Winter Half-Length Apron Winter Skirt Women's Thickened,2221.0,3109.0,29.0,/generic-winter-half-length-apron-winter-skirt-womens-thickened-192275423.html
1 X Bowl Charcoal Holder Head Stove Heater Accessories Tool,1853.0,3626.0,49.0,/generic-1-x-bowl-charcoal-holder-head-stove-heater-accessories-tool-191244178.html
Kids' Educational Learning Tablets Toys,1924.0,2985.0,36.0,/generic-kids-educational-learning-tablets-toys-191822296.html
Fashion Male Clic Round Sungles Men Retro Grey Frame SunGles Women Gold Alloy Leg Uni UV400 O130,2975.0,5032.0,41.0,/fashion-male-clic-round-sungles-men-retro-grey-frame-sungles-women-gold-alloy-leg-uni-uv400-o130-192100757.html
Men Laptop Bag Sleeve Handbag Notebook Carrying Case For Macbook Air Pro 11.6 13.3 15.6 Inch Dell Asus Microsoft women Mouse Bag,5224.0,8880.0,41.0,/generic-men-laptop-bag-sleeve-handbag-notebook-carrying-case-for-macbook-air-pro-11.6-13.3-15.6-inch-dell-asus-microsoft-women-mouse-bag-193247184.html
Fashion Trench Coat Men Streetwear Long Jacket,18100.0,20100.0,10.0,/fashion-trench-coat-men-streetwear-long-jacket-192271910.html
For PS5 Disk GUNDAM PVC Skin Vinyl Sticker Decal Cover Console DualSense Controllers Dustproof Protective Sticker,4825.0,8288.0,42.0,/generic-for-ps5-disk-gundam-pvc-skin-vinyl-sticker-decal-cover-console-dualsense-controllers-dustproof-protective-sticker-192764726.html
12pcs Non-Slip Duvet Cover Clips Sheet Cover Fitted Bedding For Socks,1000.0,1999.0,50.0,/generic-12pcs-non-slip-duvet-cover-clips-sheet-cover-fitted-bedding-for-socks-191529273.html
1 Set of Love Birds Ceramic Salt and Pepper Shakers,592.0,984.0,40.0,/generic-1-set-of-love-birds-ceramic-salt-and-pepper-shakers-191132875.html
Pair Car Interior Door Handle Cover Panel Trims For Subaru,7804.0,13424.0,42.0,/generic-pair-car-interior-door-handle-cover-panel-trims-for-subaru-96666202.html
43 In 1 EVA Portable Car Home Outdoor Emergency Supplies Kit Survival Rescue Box(Orange),2664.0,4265.0,38.0,/generic-43-in-1-eva-portable-car-home-outdoor-emergency-supplies-kit-survival-rescue-boxorange-192006343.html
For Nokia T20 10.4'' Tablet Tempered Glass Screen Protector  Protective Film(#Nokia T20 2PCS),2050.0,4090.0,50.0,/generic-for-nokia-t20-10.4-tablet-tempered-glass-screen-protector-protective-filmnokia-t20-2pcs-191578079.html
LCD Screen And Digitizer Fullembly With Frame For Alcatel 1SE 2020 OT5030 5030 5030D 5030F (Black),9640.0,19270.0,50.0,/generic-lcd-screen-and-digitizer-fullembly-with-frame-for-alcatel-1se-2020-ot5030-5030-5030d-5030f-black-191480716.html
4Pcs 2Pcs G.SKILL  Games RAM 8GB 4GB 1866MHz 1600MHz 1333MHz Desktop Memory 240 Pins 1.5V RAM Memory Module Dual ,11411.0,19536.0,42.0,/generic-4pcs-2pcs-g.skill-games-ram-8gb-4gb-1866mhz-1600mhz-1333mhz-desktop-memory-240-pins-1.5v-ram-memory-module-dual-191418843.html
Double Head Clay Sculpting Tools Non Slip Handle Stainless Steel,740.0,1181.0,37.0,/generic-double-head-clay-sculpting-tools-non-slip-handle-stainless-steel-191805356.html
Rimless Sunglasses Fashion Sunglasses Women Tide Vasos Decorativos Vogue Lunette,1184.0,1806.0,34.0,/generic-rimless-sunglasses-fashion-sunglasses-women-tide-vasos-decorativos-vogue-lunette-191479991.html
15Pcs For Ecovacs T9 POWER MAX AIVI Cleaner Main Side,3691.0,7088.0,48.0,/generic-15pcs-for-ecovacs-t9-power-max-aivi-cleaner-main-side-132599071.html
Dual Ultrasonic Dog Barking Control Device Outdoor,4030.0,8060.0,50.0,/generic-dual-ultrasonic-dog-barking-control-device-outdoor-192052760.html
YD04 Stereo Wireless Headphone Noise Reduction BT Earphones,1100.0,2200.0,50.0,/generic-yd04-stereo-wireless-headphone-noise-reduction-bt-earphones-192047177.html
Women Pendant Good-looking 26 Letters Heart Lady Necklace K,272.0,341.0,20.0,/generic-women-pendant-good-looking-26-letters-heart-lady-necklace-k-207521629.html
Mini Travel Electric  Silent Shaving Machine Black 2 Heads Mesh,2660.0,5319.0,50.0,/generic-mini-travel-electric-silent-shaving-machine-black-2-heads-mesh-191462010.html
Laptop Bag 13 13.3 14 15.6 16 inch for  MacBook Air 15 M2 A2941 Case Lenovo Asus HP Acer Dell Men Women Notebook Handbag,5550.0,9472.0,41.0,/generic-laptop-bag-13-13.3-14-15.6-16-inch-for-macbook-air-15-m2-a2941-case-lenovo-asus-hp-acer-dell-men-women-notebook-handbag-193314043.html
COLBOR CL60R Portable RGB Video Light 65W COB Photography,25400.0,48260.0,47.0,/generic-colbor-cl60r-portable-rgb-video-light-65w-cob-photography-192568261.html
2600mah Usb External  Case Pack Box 18650 Charger,6216.0,9176.0,32.0,/generic-2600mah-usb-external-case-pack-box-18650-charger-191070234.html
Bike Tubeless Tire Tyre Repair Kit Plugs Tool Fits For Bicycle 1 Set,592.0,984.0,40.0,/generic-bike-tubeless-tire-tyre-repair-kit-plugs-tool-fits-for-bicycle-1-set-191661342.html
Glass Back Cover For Apple Watch Series 5 44mm,950.0,1899.0,50.0,/generic-glass-back-cover-for-apple-watch-series-5-44mm-191474844.html
Simple Tote Men Business Briefcase Handbag For 15.6 inch Laptop Bags Large Capacity Shoulder Bags vel Notebook Messenger Bag,3256.0,5476.0,41.0,/generic-simple-tote-men-business-briefcase-handbag-for-15.6-inch-laptop-bags-large-capacity-shoulder-bags-vel-notebook-messenger-bag-193251185.html
Skid Proof Console Vertical Stand For PS3 Super Slim 4000 Modern,950.0,1899.0,50.0,/generic-skid-proof-console-vertical-stand-for-ps3-super-slim-4000-modern-191459247.html
M100 2.4G/5G 4K Miracast Any Cast Wireless DLNA AirPlay,3351.0,5784.0,42.0,/generic-m100-2.4g5g-4k-miracast-any-cast-wireless-dlna-airplay-192083212.html
Baby Wrist Foot Rattles Infant Toys 3-6 Months,3256.0,4884.0,33.0,/generic-baby-wrist-foot-rattles-infant-toys-3-6-months-191025164.html
Orthdent 1040 Pcs/Pack Dental Ligature Ties Orthodontics Appliance Elastic Rubber Bands Braces Teeth Treatment Dentist Materials,3950.0,5926.0,33.0,/generic-orthdent-1040-pcspack-dental-ligature-ties-orthodontics-appliance-elastic-rubber-bands-braces-teeth-treatment-dentist-materials-191889450.html
2 Pieces GPU 180 Degree Angle Adapter Board For Desktops 8PIN,870.0,1739.0,50.0,/generic-2-pieces-gpu-180-degree-angle-adapter-board-for-desktops-8pin-191487478.html
OLED Material LCD Screen With Frame For Samsung Galaxy S9+,31076.0,44397.0,30.0,/generic-oled-material-lcd-screen-with-frame-for-samsung-galaxy-s9-192486443.html
L2 Wireless Business BT Headset In-Ear Retractable Earphone,1787.0,3038.0,41.0,/generic-l2-wireless-business-bt-headset-in-ear-retractable-earphone-191161496.html
Ear Protection Winter Hat Cozy Unisex Waterproof Lei Feng Hat Fleece Navy Blue,1054.0,1581.0,33.0,/generic-ear-protection-winter-hat-cozy-unisex-waterproof-lei-feng-hat-fleece-navy-blue-192380853.html
For LED Acrylic Strips Light Part Backlight Guide Car Ambient Lights e Matt Black Tape Sticker Ambient Lighting Tape,3759.0,6364.0,41.0,/generic-for-led-acrylic-strips-light-part-backlight-guide-car-ambient-lights-e-matt-black-tape-sticker-ambient-lighting-tape-191429027.html
Herb Stripper Tool Comb Shape Quickly And Efficiently For Kale,592.0,984.0,40.0,/generic-herb-stripper-tool-comb-shape-quickly-and-efficiently-for-kale-191084907.html
ESLNF Solar Camping Light LED Campsite Lantern Emergency,1653.0,2314.0,29.0,/generic-eslnf-solar-camping-light-led-campsite-lantern-emergency-192270209.html
3D Metal GTR Badge Car Fender Body Trunk Decoration Sticker For Nissan Skyline Almera Qashqai Note Tiida Teana Juke Xil Nismo,3123.0,5328.0,41.0,/generic-3d-metal-gtr-badge-car-fender-body-trunk-decoration-sticker-for-nissan-skyline-almera-qashqai-note-tiida-teana-juke-xil-nismo-192432045.html
For HP Pavilion Gaming 15 15-CX TPN-C133 Laptop LCD Back Cover Front bezel Hinges Palmrest Bottom Case Top L20314-001 Green,21978.0,37740.0,42.0,/generic-for-hp-pavilion-gaming-15-15-cx-tpn-c133-laptop-lcd-back-cover-front-bezel-hinges-palmrest-bottom-case-top-l20314-001-green-191418632.html
 For Garmin Alpha 100 Alpha100 shell with ces front cover back case accessories rea reaement parts,5501.0,9472.0,42.0,/generic-for-garmin-alpha-100-alpha100-shell-with-ces-front-cover-back-case-accessories-rea-reaement-parts-191025906.html
10 Inch Empty Tape Reel Universal Blank Tape Reel Empty Audio Disc Opening Tool for BASF/REEL TO REEL Disk for Studer ReVox/TEAC,5950.0,10212.0,42.0,/generic-10-inch-empty-tape-reel-universal-blank-tape-reel-empty-audio-disc-opening-tool-for-basfreel-to-reel-disk-for-studer-revoxteac-191208368.html
Electric  Arm Accessory   Washers,2664.0,4410.0,40.0,/generic-electric-arm-accessory-washers-191796537.html
Soft Silicone Case With Carabiner Wireless Earphone Protective For AirPods,870.0,1739.0,50.0,/generic-soft-silicone-case-with-carabiner-wireless-earphone-protective-for-airpods-191434123.html
Fashion Vintage Square Sungles For Women Men Luxury Brand Retro Overside Frame Gles Driving Polarized Eyewear UV400,3064.0,5180.0,41.0,/fashion-vintage-square-sungles-for-women-men-luxury-brand-retro-overside-frame-gles-driving-polarized-eyewear-uv400-192101225.html
Cloth Cutlery Storage Bag Spoon Chopsticks Fork Organizer Pen Pencil J,740.0,1181.0,37.0,/generic-cloth-cutlery-storage-bag-spoon-chopsticks-fork-organizer-pen-pencil-j-191789682.html
Compact Headphone Amplifier 4 Channels AC12V 300MA PH-4 For Audio,8810.0,17619.0,50.0,/generic-compact-headphone-amplifier-4-channels-ac12v-300ma-ph-4-for-audio-191506624.html
Handheld Laser Rangefinder Distance Meter Area Volumes,4308.0,6969.0,38.0,/generic-handheld-laser-rangefinder-distance-meter-area-volumes-192072284.html
Chandelier Lampshade Table Lamp Lampshade Simple Iron,1200.0,2280.0,47.0,/generic-chandelier-lampshade-table-lamp-lampshade-simple-iron-192608115.html
10m LED Flexible Neon Rope Strip Light Christmas Outdoor Waterproof 110V/220V Warm White,13552.0,27022.0,50.0,/generic-10m-led-flexible-neon-rope-strip-light-christmas-outdoor-waterproof-110v220v-warm-white-191261528.html
915 Generation Universal Multi-Sharp Rotary Layer Lawn Mower Sharpener For,2168.0,4011.0,46.0,/915-generation-universal-multi-sharp-rotary-layer-lawn-mower-sharpener-for-131592461.html
"915 Generation Wedding Bridal Bouquet, Wedding Bride Bouquet, Wedding",4267.0,7894.0,46.0,/915-generation-wedding-bridal-bouquet-wedding-bride-bouquet-wedding-128706050.html
915 Generation Beach Chair Cover,32074.0,59337.0,46.0,/915-generation-beach-chair-cover-131663101.html
915 Generation Motorcycle 3D Fiber Sticker Sets Z1000 2014-2018 Accessories,6904.0,13119.0,47.0,/915-generation-motorcycle-3d-fiber-sticker-sets-z1000-2014-2018-accessories-128958113.html
"RCmall 2.4"" ESP32 Module WIFI+BT Development Board 240*320 ESP32 Display Screen LCD TFT Module Capacitive Touch ESP32-2432S024C",5224.0,8880.0,41.0,/generic-rcmall-2.4-esp32-module-wifibt-development-board-240320-esp32-display-screen-lcd-tft-module-capacitive-touch-esp32-2432s024c-191671346.html
5 Pack Halloween Flame Ghost Ring Games Toys Halloween,2960.0,4906.0,40.0,/generic-5-pack-halloween-flame-ghost-ring-games-toys-halloween-191270978.html
L Shape Right Angle Corner Clamp Woodworking Square Tool 150mm Plastic,592.0,984.0,40.0,/generic-l-shape-right-angle-corner-clamp-woodworking-square-tool-150mm-plastic-191273836.html
Kids Wooden Clock Shape Sorting Educational Preschool Puzzle Blocks Toddler Toy,5328.0,7992.0,33.0,/generic-kids-wooden-clock-shape-sorting-educational-preschool-puzzle-blocks-toddler-toy-191060516.html
Glasses Pouch PU Leather Slim Strap Design Spectacles Storage Black,592.0,984.0,40.0,/generic-glasses-pouch-pu-leather-slim-strap-design-spectacles-storage-black-191642805.html
Laptop cover For HP 1000 450 455 CQ45-m00 6070B0592901 685080-001 Palmrest Upper cover Bottom case Base Cover embly,15037.0,25900.0,42.0,/generic-laptop-cover-for-hp-1000-450-455-cq45-m00-6070b0592901-685080-001-palmrest-upper-cover-bottom-case-base-cover-embly-191565526.html
Josby New Fishing Line Super Strong 50000m 100m X12 100% Pe Braided Wire High Strength 12 Strands 1000m Saltwater Carp Pesca,2631.0,4474.0,41.0,/generic-josby-new-fishing-line-super-strong-50000m-100m-x12-100-pe-braided-wire-high-strength-12-strands-1000m-saltwater-carp-pesca-187477828.html
Fashion Sungles Man Johnny D Lemtosh Polarized Sun Gles Woman Luxury Brand Vintage Acetate Frame Blue Night Vision Goles,7681.0,13172.0,42.0,/fashion-sungles-man-johnny-d-lemtosh-polarized-sun-gles-woman-luxury-brand-vintage-acetate-frame-blue-night-vision-goles-192077732.html
Baby Wrist Foot Rattles Infant Toys 3-6 Months,3256.0,4884.0,33.0,/generic-baby-wrist-foot-rattles-infant-toys-3-6-months-191034327.html
Busy Board Door Latch Toys Develop Motor Skills Gifts For Boys,653.0,851.0,23.0,/generic-busy-board-door-latch-toys-develop-motor-skills-gifts-for-boys-191410043.html
Smart Watch I5 Waterproof Heart Rate Monitor Smartwatch,1036.0,1613.0,36.0,/generic-smart-watch-i5-waterproof-heart-rate-monitor-smartwatch-192380874.html
Fashion Outdoor Men Mid Top WaterProof Mountain Hiking Boots,5570.0,11140.0,50.0,/fashion-outdoor-men-mid-top-waterproof-mountain-hiking-boots-191996977.html
Men's Winter Hat Women's Unisex Knitted Hat,2516.0,3956.0,36.0,/generic-mens-winter-hat-womens-unisex-knitted-hat-191769746.html
"915 Generation Wooden Easel, 12 Pieces, Painting, Children, Artist, Adult,",4860.0,8991.0,46.0,/915-generation-wooden-easel-12-pieces-painting-children-artist-adult-129960905.html
11 12 13 14 15.6 Inch Laptop Bag Sleeve Case Tablet Bag Protect Notebook Computer Pouch Cover for Macbook Air Pro Lenovo HP Acer,3685.0,6216.0,41.0,/generic-11-12-13-14-15.6-inch-laptop-bag-sleeve-case-tablet-bag-protect-notebook-computer-pouch-cover-for-macbook-air-pro-lenovo-hp-acer-193285283.html
"IPhone 11 Case, Shockproof Antislip Rugged Bumper Builtin Screen Protector 360° Fullbody Protection Case Cover For IPhone 11",1733.0,3405.0,49.0,/generic-iphone-11-case-shockproof-antislip-rugged-bumper-builtin-screen-protector-360-fullbody-protection-case-cover-for-iphone-11-208565769.html
Cute Realistic Cat Animal Furry Interior Ornament Kids,635.0,941.0,33.0,/generic-cute-realistic-cat-animal-furry-interior-ornament-kids-192195156.html
Fashion Mens Sports Running Shoes Breathable Walking Trainers Footwear,4000.0,8000.0,50.0,/fashion-mens-sports-running-shoes-breathable-walking-trainers-footwear-192049079.html
Fashion Girls' Clothing Children's Party Dress,4100.0,4500.0,9.0,/fashion-girls-clothing-childrens-party-dress-191874015.html
For BMW 4 M-Sport F32 F33 F36 2013 2018 Fornt Bumper Headlight Washer Nozzle Cover Sprayer Cap Trim ed,10005.0,17168.0,42.0,/generic-for-bmw-4-m-sport-f32-f33-f36-2013-2018-fornt-bumper-headlight-washer-nozzle-cover-sprayer-cap-trim-ed-192451864.html
Andoer V-Lock V Mount Battery Plate To BP-U Dummy Battery,10735.0,19323.0,44.0,/andoer-v-lock-v-mount-battery-plate-to-bp-u-dummy-battery-192046961.html
Applicable to Samsung S24ultra Magnetic Mobile Phone Shell Contrast Color Drop-Resistant A54 Lens All-Inclusive Protective Cover Frosted Shell S22,3404.0,4144.0,18.0,/generic-applicable-to-samsung-s24ultra-magnetic-mobile-phone-shell-contrast-color-drop-resistant-a54-lens-all-inclusive-protective-cover-frosted-shell-s22-199039308.html
"ps5 case, ps4 control on, video game controller accessories",2797.0,4736.0,41.0,/generic-ps5-case-ps4-control-on-video-game-controller-accessories-192772247.html
For X box one s console sticker and 2 controllers sticker for X BOX ONE S vinyl sticker for x box one s pvc sticker-,3404.0,5772.0,41.0,/generic-for-x-box-one-s-console-sticker-and-2-controllers-sticker-for-x-box-one-s-vinyl-sticker-for-x-box-one-s-pvc-sticker-191838148.html
PENGGONG 6 PCS Screwdriver Set With Tool Bag Assorted  &,2057.0,3703.0,44.0,/generic-penggong-6-pcs-screwdriver-set-with-tool-bag-assorted-192056200.html
Solid Color Faux Leather Sheets Cross Textured Synthetic Leather Fabric Roll for DIY Earrings Hair Bows Handbags Crafts,4795.0,8140.0,41.0,/generic-solid-color-faux-leather-sheets-cross-textured-synthetic-leather-fabric-roll-for-diy-earrings-hair-bows-handbags-crafts-192294852.html
Universal 14/15/17 inch DIY Laptop Decal Sticker Laptop Skin Cover for HP/Acer/Dell/ASUS/ /Xiaomi/macbook air Notebook,3226.0,5476.0,41.0,/generic-universal-141517-inch-diy-laptop-decal-sticker-laptop-skin-cover-for-hpacerdellasus-xiaomimacbook-air-notebook-193251276.html
11 12 13 14 15.6 Inch Laptop Bag Sleeve Case Tablet Bag Protect Notebook Computer Pouch Cover for Macbook Air Pro Lenovo HP Acer,3685.0,6216.0,41.0,/generic-11-12-13-14-15.6-inch-laptop-bag-sleeve-case-tablet-bag-protect-notebook-computer-pouch-cover-for-macbook-air-pro-lenovo-hp-acer-193260049.html
Fashion New NX8 Smart Watch Men's Outdoor Sports,12211.0,23202.0,47.0,/fashion-new-nx8-smart-watch-mens-outdoor-sports-206560501.html
Solid Color Faux Leather Sheets Cross Textured Synthetic Leather Fabric Roll for DIY Earrings Hair Bows Handbags Crafts,4795.0,8140.0,41.0,/generic-solid-color-faux-leather-sheets-cross-textured-synthetic-leather-fabric-roll-for-diy-earrings-hair-bows-handbags-crafts-192284613.html
20pcs S-Adhesive Wall Tile Stickers DIY  Pattern 3D PVC Wallpaper Wall Panel Home Decor Waterproof Wall Paper,6201.0,10656.0,42.0,/generic-20pcs-s-adhesive-wall-tile-stickers-diy-pattern-3d-pvc-wallpaper-wall-panel-home-decor-waterproof-wall-paper-192766055.html
Car Navigation Holder Multi-Function Car Phone Holder Gravity Sensing Car Phone Holder Air Outlet,3404.0,4144.0,18.0,/generic-car-navigation-holder-multi-function-car-phone-holder-gravity-sensing-car-phone-holder-air-outlet-192036460.html
Fashion Men's Polarized Sungles Lifestyles Mirrored Color Blocking Sun Gles Women Legend Square Sungl With Box,3241.0,5476.0,41.0,/fashion-mens-polarized-sungles-lifestyles-mirrored-color-blocking-sun-gles-women-legend-square-sungl-with-box-192079307.html
Lady Hair Clamp Plumeria Paradise Hair Claw Clip Strong Hold for Thick Lake Blue,219.0,329.0,33.0,/generic-lady-hair-clamp-plumeria-paradise-hair-claw-clip-strong-hold-for-thick-lake-blue-192511615.html
TONIVENT Portable Cassette To MP3 Player Mini USB Tape,3336.0,6339.0,47.0,/generic-tonivent-portable-cassette-to-mp3-player-mini-usb-tape-192046820.html
Fashion Summer Large Capacity Sw Shoulder Bag Rattan Beach Bags Woven Handle Bag Casual Lady Totes Shopping Handbag Clutch,5180.0,9028.0,43.0,/fashion-summer-large-capacity-sw-shoulder-bag-rattan-beach-bags-woven-handle-bag-casual-lady-totes-shopping-handbag-clutch-192509848.html
Coffee Filter Stainless Steel Hand Brewed Coffee Pot Filter,1036.0,1628.0,36.0,/generic-coffee-filter-stainless-steel-hand-brewed-coffee-pot-filter-192366925.html
Tuya Wifi Intelligent Home Switch SpringBack Light Switch,2072.0,3730.0,44.0,/generic-tuya-wifi-intelligent-home-switch-springback-light-switch-192121088.html
"Children's Electric Car Receiver,Blue Receiver",1282.0,2469.0,48.0,/generic-childrens-electric-car-receiverblue-receiver-192405049.html
Fashion Girls' Clothing Children's Party Dress,2600.0,2900.0,10.0,/fashion-girls-clothing-childrens-party-dress-191874613.html
2 PCS Zinc Alloy Cabinet Door Handle,1658.0,2371.0,30.0,/generic-2-pcs-zinc-alloy-cabinet-door-handle-192426342.html
Matte Black Letters C180 C200 C220d C250d C260 C300d 4Matic ABS Emblem for Mercedes Benz W205 Coupe Car Trunk Logo Sticker,4603.0,7844.0,41.0,/generic-matte-black-letters-c180-c200-c220d-c250d-c260-c300d-4matic-abs-emblem-for-mercedes-benz-w205-coupe-car-trunk-logo-sticker-192441998.html
Multi-purpose Professional T130 0.3mm Airbrush Max 30PSI,8584.0,14064.0,39.0,/generic-multi-purpose-professional-t130-0.3mm-airbrush-max-30psi-202198446.html
PVC Waterproof S Adhesive Wallpaper Roll Furniture Cabinets Vinyl Decorative Film Wood Grain Stickers For DIY Home Decor,2679.0,4588.0,42.0,/generic-pvc-waterproof-s-adhesive-wallpaper-roll-furniture-cabinets-vinyl-decorative-film-wood-grain-stickers-for-diy-home-decor-192777774.html
Car Roof Radio Shark Fin Car Shark  Radio FM Signal Design For All Cars s  Car Styling Gift Fun Sticker ,4603.0,7844.0,41.0,/generic-car-roof-radio-shark-fin-car-shark-radio-fm-signal-design-for-all-cars-s-car-styling-gift-fun-sticker-192478447.html
Palm rest bottom shell for HP 17-BY 17-CA CR 17Q-CS 470 G7 TPN-I133 laptop upper cover keyboard frame lower cover case,9931.0,17020.0,42.0,/generic-palm-rest-bottom-shell-for-hp-17-by-17-ca-cr-17q-cs-470-g7-tpn-i133-laptop-upper-cover-keyboard-frame-lower-cover-case-192253458.html
Fashion Outdoor Men WaterProof Mountain Trekking Boots,5480.0,10960.0,50.0,/fashion-outdoor-men-waterproof-mountain-trekking-boots-191997070.html
Star Wings TV Dock Charger Silicone Protector For Switch/NS Oled Hard Case Joy-Con Soft Hand Grip Shell Thumb Stick Cap Cover,6956.0,11840.0,41.0,/generic-star-wings-tv-dock-charger-silicone-protector-for-switchns-oled-hard-case-joy-con-soft-hand-grip-shell-thumb-stick-cap-cover-192781176.html
36 Pieces Round Cookie Cutters Set Cookie Cutter Set,4613.0,8858.0,48.0,/generic-36-pieces-round-cookie-cutters-set-cookie-cutter-set-192530422.html
Dimmable LED Recessed Downlight 3W 5W 7W 12W 15W Bhite/Black Body Ceiling Spot Light with 90-265V LED Driver 3000K 4000K 6000K,12950.0,22200.0,42.0,/generic-dimmable-led-recessed-downlight-3w-5w-7w-12w-15w-bhiteblack-body-ceiling-spot-light-with-90-265v-led-driver-3000k-4000k-6000k-192141137.html
3D Metal NISMO Logo Front Grill Emblem Badge Rear Trunk Sticker Decals for Nissan Tiida Teana Qashqai Almera Juke X il,3330.0,5624.0,41.0,/generic-3d-metal-nismo-logo-front-grill-emblem-badge-rear-trunk-sticker-decals-for-nissan-tiida-teana-qashqai-almera-juke-x-il-192433867.html
Car Brake Pedal Foot Pedal Pads Accessories for,2960.0,4755.0,38.0,/generic-car-brake-pedal-foot-pedal-pads-accessories-for-191355859.html
35cm 48cm Universal Fit Car Spoiler Lateral Bumper Rear Side Skirt Lip Rocker Wings Carbon Fiber Glossy Black Protection Trims,3952.0,6808.0,42.0,/generic-35cm-48cm-universal-fit-car-spoiler-lateral-bumper-rear-side-skirt-lip-rocker-wings-carbon-fiber-glossy-black-protection-trims-192450153.html
